?class	?label	?definition
<http://purl.obolibrary.org/obo/ENVO_01000528>	"dry toilet fixture"	"A toilet fixture which uses little to no water; excreta is removed manually or composted in situ."
<http://purl.obolibrary.org/obo/ENVO_00000128>	"dry valley"	"A valley which no longer has water flowing or accumulating over its surface."
<http://purl.obolibrary.org/obo/ENVO_03501284>	"dryer"	"A device designed to remove water or humidity."
<http://purl.obolibrary.org/obo/ENVO_00000170>	"dune"	"A hill of sand built by eolian processes."
<http://purl.obolibrary.org/obo/ENVO_00000308>	"dune slack"	"A valley or trough between two dunes."
<http://purl.obolibrary.org/obo/ENVO_03510010>	"dye"	"A coloured substance that chemically bonds to the substrate to which it is being applied"
<http://purl.obolibrary.org/obo/ENVO_03501353>	"eating utensil"	"A utensil used for consuming food."
<http://purl.obolibrary.org/obo/ENVO_01000572>	"electric lamp"	"An electric lamp is a lamp which produces light from electricity."
<http://purl.obolibrary.org/obo/ENVO_01000865>	"electric power system"	"An electric power system is a network of electrical components used to supply, transfer and use electric power."
<http://purl.obolibrary.org/obo/ENVO_03600005>	"electrical switch"	"A manufactured product which is capable of connecting or disconnecting the conducting path in an electrical circuit, interrupting the electric current or diverting it from one conductor to another."
<http://purl.obolibrary.org/obo/ENVO_00000176>	"elevated landform"	"A landform elevated above the surrounding area."
<http://purl.obolibrary.org/obo/ENVO_03510027>	"enamel thinner"	"A paint thinner specific for altering the viscosity of enamel paints."
<http://purl.obolibrary.org/obo/ENVO_00000551>	"endorheic basin"	"A drainage basin from which there is no outflow of water, either on the surface as rivers, or underground by flow or diffusion through rock or permeable material."
<http://purl.obolibrary.org/obo/ENVO_00000197>	"endorheic lake"	"A lake from which there is no outflow of water, either on the surface as rivers, or underground by flow or diffusion through rock or permeable material."
<http://purl.obolibrary.org/obo/ENVO_03000018>	"englacial stream"	"A stream which is primarily composed of meltwater and which flows within a glacier or ice sheet."
<http://purl.obolibrary.org/obo/ENVO_01001818>	"enrichment culturing unit"	"A biomaterial culturing unit which is designed to promote the growth of selected cell populations (often at the expense of others) within a community by altering the conditions of the environment within its confines."
<http://purl.obolibrary.org/obo/ENVO_00000204>	"ephemeral spring"	"A spring through which fluid intermittently flows."
<http://purl.obolibrary.org/obo/ENVO_03501359>	"equipment frame"	"A manufactured product which is a structural system on which equipment components are mounted."
<http://purl.obolibrary.org/obo/ENVO_03501360>	"equipment leg"	"A manufactured product which positions a piece of equipment above a surface."
<http://purl.obolibrary.org/obo/ENVO_01000363>	"erosional cave"	"A cave formed by erosion caused by flowing streams carrying rocks or sediments."
<http://purl.obolibrary.org/obo/ENVO_00000280>	"escarpment"	"A slope which separates different physiogeographic provinces that are typically composed of rocks of different age and compositoin."
<http://purl.obolibrary.org/obo/ENVO_00000282>	"esker"	"A long, winding ridge of stratified sand and gravel which occur in glaciated and formerly glaciated regions of Europe and North America."
<http://purl.obolibrary.org/obo/ENVO_00000045>	"estuary"	"A semi-enclosed coastal body of water with one or more rivers or streams flowing into it, and with a free connection to the open sea."
<http://purl.obolibrary.org/obo/ENVO_01000548>	"eutrophic lake"	"A lake which has nutrient-rich water."
<http://purl.obolibrary.org/obo/ENVO_03600037>	"eutrophic pond"	"A pond which has nutrient-rich water."
<http://purl.obolibrary.org/obo/ENVO_01000824>	"exorheic lake"	"A lake from which water constantly flows out of under almost all climatic circumstances, maintaining low concentrations of dissolved solid relative to endorheic lakes."
<http://purl.obolibrary.org/obo/ENVO_00003894>	"face cream product"	"A cosmetic product which has been formulated 2) to have a viscous, fatty, liquid consistency resembling the fat-rich component of milk and 2) to be applied to human facial skin to modify its appearance or functioning."
<http://purl.obolibrary.org/obo/ENVO_01000985>	"fairground"	"A part of an ecosystem which has been allocated to host a gathering of people for multiple entertainment or commercial activities."
<http://purl.obolibrary.org/obo/ENVO_00000071>	"fault cave"	"A cave developed along a fault or fault zone, either by movement of the fault or by preferential solution along it."
<http://purl.obolibrary.org/obo/ENVO_00000281>	"fault escarpment"	"An escarpment resulting from a fault."
<http://purl.obolibrary.org/obo/ENVO_03600039>	"fermentation pit"	"A pit which has been constructed for use in fermentation processes that will yield alcoholic spirits."
<http://purl.obolibrary.org/obo/ENVO_03600040>	"fermentation starter"	"A manufactured product which assists starting a fermentation process which is intended to prepare foods and alcoholic drinks."
<http://purl.obolibrary.org/obo/ENVO_03501100>	"ferry"	"A merchant vessel which is used to carry passengers, vehicles, or cargo across a body of water."
<http://purl.obolibrary.org/obo/ENVO_01000352>	"field"	"An unbroken expanse (as of ice)"
<http://purl.obolibrary.org/obo/ENVO_03000132>	"firebreak"	"A woodland clearing which is large enough to starve land fires of fuel, impeding their progress through wooded areas."
<http://purl.obolibrary.org/obo/ENVO_06105115>	"fishing gear"	"A manufactured product which is used for fishing."
<http://purl.obolibrary.org/obo/ENVO_00000056>	"fishpond"	"A pond or lake used for the artificial culture of fish."
<http://purl.obolibrary.org/obo/ENVO_00000263>	"fissure cave"	"A narrow, vertical cave passage, often developed along a joint but not necessarily so. Usually due to solution but sometimes to tension."
<http://purl.obolibrary.org/obo/ENVO_00000039>	"fjord"	"A long and narrow sea inlet with high steeply sloped walled sides. A fjord is a landform created during a period of glaciation."
<http://purl.obolibrary.org/obo/ENVO_00000201>	"fjord lake"	"A lake in a glacially eroded valley, which has been eroded below sea level."
<http://purl.obolibrary.org/obo/ENVO_01000713>	"flash flood"	"A flash flood is a flood formed by the rapid flooding of geomorphic low-lying areas. It may be caused by heavy rain associated with a severe thunderstorm, hurricane, tropical storm, or meltwater from ice or snow flowing over ice sheets or snowfields. Flash floods may also occur after the collapse of a natural ice or debris dam, or a human structure such as a man-made dam. Flash floods are distinguished from a regular flood by a timescale of less than six hours."
<http://purl.obolibrary.org/obo/ENVO_01000562>	"flat-wick lamp"	"A flat-wick lamp is a simple type of paraffin lamp, which burns paraffin drawn up through a wick by capillary action."
<http://purl.obolibrary.org/obo/ENVO_01001491>	"flattened elevation"	"An elevation which is flattened across its highest surface."
<http://purl.obolibrary.org/obo/ENVO_01000710>	"flood"	"An unusual accumulation of water above the ground caused by high tide, heavy rain, melting snow or rapid runoff from paved areas."
<http://purl.obolibrary.org/obo/ENVO_00000443>	"flood control reservoir"	"A reservoir constructed for the purpose of containing a flood, an overflow of water from a body of water that sumerges land."
<http://purl.obolibrary.org/obo/ENVO_00000257>	"flood fringe"	"Area of a flood plane covered by the flood, but which does not experience a strong current."
<http://purl.obolibrary.org/obo/ENVO_00000255>	"flood plain"	"An area which is subject to periodic flooding."
<http://purl.obolibrary.org/obo/ENVO_00000256>	"floodway"	"The stream channel and adjacent areas that carry flood flows in a flood plain."
<http://purl.obolibrary.org/obo/ENVO_01001479>	"fluid astronomical body part"	"A part of an astronomical body which is primarily composed of fluid."
<http://purl.obolibrary.org/obo/ENVO_00000079>	"flume"	"An open artificial water channel, that leads water from a diversion dam or weir completely aside a natural flow, often an elevated box structure (typically wood) that follows the natural contours of the land."
<http://purl.obolibrary.org/obo/ENVO_01000527>	"flush toilet fixture"	"A toilet fixture which uses water to flush liquid and solid excreta into a sewage containment or processing facility through a drainpipe."
<http://purl.obolibrary.org/obo/ENVO_01000971>	"food truck"	"A truck which is equipped to cook and sell food."
<http://purl.obolibrary.org/obo/ENVO_03501328>	"fork"	"An eating utensil with spikes used to put solid food into the mouth, or to hold food down while cutting."
<http://purl.obolibrary.org/obo/ENVO_01001111>	"fossil worm burrow"	"A channel which was formed as a result of an annelid burrowing through soil, where organic residues lining the burrow have subsequently initiated fossilization."
<http://purl.obolibrary.org/obo/ENVO_03510017>	"fountain pen ink"	"Water based ink intended for use with fountain ink pens."
<http://purl.obolibrary.org/obo/ENVO_01000593>	"framed bed"	"A framed bed is a piece of furniture which is composed of a mattress supported by a bed base and held in place by a bed frame."
<http://purl.obolibrary.org/obo/ENVO_00002198>	"fresh water aquarium"	"A fresh water aquarium is an aquarium which contains fresh water as its primary ecological medium."
<http://purl.obolibrary.org/obo/ENVO_01001320>	"fresh water body"	"A body of water which is primarily composed of freshwater, with low solute content."
<http://purl.obolibrary.org/obo/ENVO_2000005>	"freshwater algal bloom"	"An algal bloom that is located in freshwater. Freshwater algal blooms are the result of an excess of nutrients, particularly some phosphates."
<http://purl.obolibrary.org/obo/ENVO_00000021>	"freshwater lake"	"A lake of whose water contains low concentrations of salts."
<http://purl.obolibrary.org/obo/ENVO_01000297>	"freshwater river"	"A river where fresh water flows."
<http://purl.obolibrary.org/obo/ENVO_01000598>	"freshwater spring"	"A spring through which fresh water flows."
<http://purl.obolibrary.org/obo/ENVO_03605007>	"freshwater stream"	"A stream which is composed primarily of fresh water."
<http://purl.obolibrary.org/obo/ENVO_01001538>	"frost-formed hummock"	"A hummock which is primarily composed of soil that has been pushed up by frost action."
<http://purl.obolibrary.org/obo/ENVO_00000216>	"fumarole"	"A hole in the Earth's crust from which steam and gases are emitted."
<http://purl.obolibrary.org/obo/ENVO_01000754>	"fumarole-derived ice tower"	"A hollow tower of ice formed by the freezing of steam escaping a fumarole."
<http://purl.obolibrary.org/obo/ENVO_00000011>	"garden"	"An enclosure for displaying selected plant or animal life."
<http://purl.obolibrary.org/obo/ENVO_01001870>	"gas well"	"A well which has been drilled in order to extract natrual gas from subterranean reservoirs and bring it to the surface."
<http://purl.obolibrary.org/obo/ENVO_01001478>	"gaseous astronomical body part"	"A part of an astronomical body which is primarily composed of gaseous material."
<http://purl.obolibrary.org/obo/ENVO_01001645>	"gaseous part of an atmosphere"	"That part of an atmosphere which is composed of gaseous material."
<http://purl.obolibrary.org/obo/ENVO_03000015>	"geographic basin"	"A depression which is part of a planetary crust, is of geographic scale, and is partially or completely enclosed."
<http://purl.obolibrary.org/obo/ENVO_00000000>	"geographic feature"	"An astrononmical body part which delimited by physical discontinuities with its surroundings."
<http://purl.obolibrary.org/obo/ENVO_00000539>	"geographic sill"	"The low part of a gap or saddle separating basins."
<http://purl.obolibrary.org/obo/ENVO_01000668>	"geological fault"	"A geological fault is a planar fracture or discontinuity in a volume of rock, across which there has been significant displacement as a result of rock mass movement."
<http://purl.obolibrary.org/obo/ENVO_01000667>	"geological fracture"	"A geological fracture is any separation in a geologic formation, such as a joint or a fault that divides a mass of rock into two or more pieces."
<http://purl.obolibrary.org/obo/ENVO_01000672>	"geological joint"	"A joint is a geological fracture which has no measureable shear displacement"
<http://purl.obolibrary.org/obo/ENVO_01001851>	"geothermally active field"	"A field in which geothermal processes occur."
<http://purl.obolibrary.org/obo/ENVO_01000908>	"geothermally heated river"	"A river which is heated by geothermal processes such as heat exchange with lava or hydrothermal percolation."
<http://purl.obolibrary.org/obo/ENVO_00000050>	"geyser"	"A hot spring that erupts periodically, ejecting a column of hot water and steam into the air."
<http://purl.obolibrary.org/obo/ENVO_00000488>	"glacial lake"	"A lake which is primarily composed of glacial meltwater and which fills a depression formed as a result of a glacial erosion process."
<http://purl.obolibrary.org/obo/ENVO_00000248>	"glacial valley"	"A valley that contains, or contained, a glacier and was formed by glacial activity. Typically U-shaped in cross-section."
<http://purl.obolibrary.org/obo/ENVO_01000364>	"glacier cave"	"A glacier cave is a cave formed within or under a glacier."
<http://purl.obolibrary.org/obo/ENVO_01001532>	"glacier ice field"	"An ice field which is constituted by a continuous accumulation of snow and glacier ice that completely fills a mountain basin or covers a low-relief mountain plateau."
<http://purl.obolibrary.org/obo/ENVO_00002112>	"gold mine drainage"	"Mine drainage which is formed as a result of the mining of gold."
<http://purl.obolibrary.org/obo/ENVO_00000290>	"graben"	"A depressed block of land bordered by parallel faults. A graben is the result of a block of land being downthrown producing a valley with a distinct scarp on each side. Grabens often occur side-by-side with horsts. Horst and graben structures are indicative of tensional forces and crustal stretching."
<http://purl.obolibrary.org/obo/ENVO_00000548>	"gravel field"	"A field which is composed primarily of gravel."
<http://purl.obolibrary.org/obo/ENVO_01000332>	"gravelly slope"	"A gravelly slope is a slope which has a surface primarily composed of gravel."
<http://purl.obolibrary.org/obo/ENVO_00000251>	"ground moraine"	"A till covered area with irregular topography and no ridges, often forming gently rolling hills or plains. Forms by the accumulation of till under the ice by lodgement, but may also be deposited as the glacier retreats."
<http://purl.obolibrary.org/obo/ENVO_00000265>	"guyot"	"A flat-topped seamount."
<http://purl.obolibrary.org/obo/ENVO_03501263>	"hand tool"	"A manufactured product which has been designed to 1) allow a human to do work more efficiently and 2) be used in a hand-held fashion."
<http://purl.obolibrary.org/obo/ENVO_00000184>	"hanging valley"	"A tributary valley with the floor at a higher relief than the main channel into which it flows. They are most commonly associated with U-shaped valleys when a tributary glacier flows into a glacier of larger volume."
<http://purl.obolibrary.org/obo/ENVO_00000463>	"harbour"	"A landform which provides shelter from atmospheric weather and marine currents, waves, and other dynamics."
<http://purl.obolibrary.org/obo/ENVO_00000153>	"headwater"	"The upper part of a river system, denoting the upper basin and source streams of a river."
<http://purl.obolibrary.org/obo/ENVO_00000046>	"hedge"	"A dense growth of shrubbery planted as a fence or boundary."
<http://purl.obolibrary.org/obo/ENVO_00000318>	"high tide zone"	"The tide zone that is flooded during high tide only, and is a highly saline environment."
<http://purl.obolibrary.org/obo/ENVO_01001459>	"high-elevation mountain"	"A mountain which has a maximum elevation greater than 2500 metres above sea level."
<http://purl.obolibrary.org/obo/ENVO_00000225>	"highly stratified estuary"	"An estuary whose river output and marine input are more even, with river flow still dominant; turbulence induces more mixing of salt water upward than the reverse."
<http://purl.obolibrary.org/obo/ENVO_00000083>	"hill"	"A rounded elevation of limited extent rising above the surrounding land with local relief of less than 300m."
<http://purl.obolibrary.org/obo/ENVO_00000082>	"hill range"	"A range of mounts which is dominated by hills."
<http://purl.obolibrary.org/obo/ENVO_03501238>	"hillock"	"A hill which is small and usually separated from a larger group of hills such as a range."
<http://purl.obolibrary.org/obo/ENVO_01000333>	"hillside"	"A hillside is a slope that is part of a hill."
<http://purl.obolibrary.org/obo/ENVO_01000285>	"holomictic lake"	"A holomictic lake is a lake which mixes at least once per year. Mixing is caused by a uniform temperature distribution from the upper to lower layers of the lake."
<http://purl.obolibrary.org/obo/ENVO_00000289>	"horst"	"The raised fault block bounded by normal faults. The raised block is a portion of the Earth's crust that has remained stationary while the land has sunk on either side of it or has been crushed by a mountain range against it."
<http://purl.obolibrary.org/obo/ENVO_00000051>	"hot spring"	"A spring through which groundwater, heated by geothermal energy, flows."
<http://purl.obolibrary.org/obo/ENVO_01000938>	"hot tub"	"A manufactured product which may hold a volume of heated water suitable for one or more humans to bathe in, usually for the purposes of hydrotherapy or pleasure."
<http://purl.obolibrary.org/obo/ENVO_01000570>	"hot-blast paraffin lantern"	"A hot-blast paraffin lantern is a tubular paraffin lantern which collects hot air from the top of the lantern globe and circulates it, through metal tubes, to the burning wick."
<http://purl.obolibrary.org/obo/ENVO_01001021>	"humic lake"	"A lake which is composed primarily water with high concentrations of humic substances and organic acids, resulting in brown- or tea-coloured colouration."
<http://purl.obolibrary.org/obo/ENVO_00000516>	"hummock"	"A patch of ground, distinct from and slightly above the surrounding plain or wetland. Often occurs in groups."
<http://purl.obolibrary.org/obo/ENVO_03510004>	"hydraulic fluid"	"A medium by which power is transferred in hydraulic machinery."
<http://purl.obolibrary.org/obo/ENVO_00000448>	"hydroelectric reservoir"	"A reservoir constructed for the purpose of generating electricity."
<http://purl.obolibrary.org/obo/ENVO_00000012>	"hydrographic feature"	"A geographical feature associated with water."
<http://purl.obolibrary.org/obo/ENVO_01000819>	"hydrosphere"	"An astronomical body part which is composed of the combined mass of water found on, under, and over the surface of a planet."
<http://purl.obolibrary.org/obo/ENVO_01001854>	"hydrothermal field"	"A geothermally active field within which geothermally heated aqueous fluids are discharged from the the surface of a rocky planet."
<http://purl.obolibrary.org/obo/ENVO_01000265>	"hydrothermal seep"	"A hydrothermal seep is a seep in which diffuse flow of geothermally heated fluids with high methane concentrations. This seep has been proposed as an intermediate between cold seeps and hydrothermal vents."
<http://purl.obolibrary.org/obo/ENVO_00000215>	"hydrothermal vent"	"A fissure in the Earths's surface from which geothermally heated water issues."
<http://purl.obolibrary.org/obo/ENVO_01001019>	"hypereutrophic lake"	"A lake which is composed primarily of water with very high nutrient concentrations."
<http://purl.obolibrary.org/obo/ENVO_01001020>	"hypersaline lake"	"A lake which is primarily composed of water with a concentration of dissolved salts greater than that of ocean water."
<http://purl.obolibrary.org/obo/ENVO_02000000>	"hypodermic needle"	"A hypodermic needle is a medical instrument made from a hollow needle. It is commonly used with a syringe to inject substances into the body of an organism."
<http://purl.obolibrary.org/obo/ENVO_01001075>	"hypoxic lake"	"A lake which is primarily composed of hypoxic water."
<http://purl.obolibrary.org/obo/ENVO_00000531>	"ice cap depression"	"A depression which is part of an ice cap."
<http://purl.obolibrary.org/obo/ENVO_00000342>	"ice cap dome"	"A comparatively elevated area on an icecap."
<http://purl.obolibrary.org/obo/ENVO_00000528>	"ice cap ridge"	"A linear elevation on an icecap."
<http://purl.obolibrary.org/obo/ENVO_01000365>	"ice cave"	"An ice cave is a bedrock cave which contains year-round ice formations."
<http://purl.obolibrary.org/obo/ENVO_00000299>	"ice field"	"A field of ice, formed in regions of perennial frost."
<http://purl.obolibrary.org/obo/ENVO_00009686>	"ice rise"	"An ice rise is an elevation which is part of an ice shelf, typically dome shared, and formed by the ice shelf overriding an obstruction in the seabed. An ice rise may be adjacent only to an ice shelf, or to an ice shelf and a sea. For some features, properly ice rises, the term island has become established through usage."
<http://purl.obolibrary.org/obo/ENVO_03600068>	"ice wedge"	"A geological fracture which is formed during winter months by a narrow or thin piece of ice."
<http://purl.obolibrary.org/obo/ENVO_00000198>	"ice-covered lake"	"A lake permanently covered by ice."
<http://purl.obolibrary.org/obo/ENVO_03000051>	"ice-encased melt pond"	"A melt pond which is completely encased in ice and thus not directly exposed to the atmosphere or underlying water."
<http://purl.obolibrary.org/obo/ENVO_01000731>	"igneous extrusion"	"A mass of igneous rock formed when hot magma flows out (extrudes) onto a planetary surface as lava or explodes violently into the atmosphere to fall back as pyroclastics or tuff."
<http://purl.obolibrary.org/obo/ENVO_01000659>	"igneous intrusion"	"An igneous intrusion is a mass of rock and minerals formed when magma cools, solidifies, and undergoes fractional crystallisation without reaching the surface."
<http://purl.obolibrary.org/obo/ENVO_01000823>	"illuminated biosphere part"	"An astronomical body part which includes those parts of a biosphere that are, at least periodically, illuminated and in which photosynthesis may occur."
<http://purl.obolibrary.org/obo/ENVO_01001071>	"impact crater"	"A crater which was formed as a result of the impact of one astronomical body on another."
<http://purl.obolibrary.org/obo/ENVO_01001070>	"impact crater lake"	"A lake which is contained in a crater formed by an impact event."
<http://purl.obolibrary.org/obo/ENVO_01000937>	"impromptu campground"	"A campground which has no pre-existing facilities installed or maintained by humans, usually found outside of anthropised ecosystems."
<http://purl.obolibrary.org/obo/ENVO_01000362>	"inflationary cave"	"A cave that is formed by the action of pressurised lava pushing against surrounding rock and then draining away."
<http://purl.obolibrary.org/obo/ENVO_01000411>	"infralittoral zone"	"A zone which is part of the sublittoral zone and is dominated by algae. This zone usually extends up to five metres below the low water mark."
<http://purl.obolibrary.org/obo/ENVO_00000089>	"inland cliff"	"A cliff which is not adjacent to a major water body."
<http://purl.obolibrary.org/obo/ENVO_01001786>	"inland sea"	"A sea which shalowly covers central areas of continents during periods of high sea level that result in marine transgressions."
<http://purl.obolibrary.org/obo/ENVO_00000475>	"inlet"	"An opening of the sea into the land, or of a lake into its shore."
<http://purl.obolibrary.org/obo/ENVO_00000494>	"insequent stream"	"A stream that has an almost random drainage often forming dendritic patterns. These are typically tributaries and have developed by a headward erosion on a horizontally stratified belt or on homogeneous rocks. These streams follow courses that apparently were not controlled by the original slope of the surface, its structure or the type of rock."
<http://purl.obolibrary.org/obo/ENVO_00000527>	"interfluve"	"A relatively undissected upland between adjacent stream valleys."
<http://purl.obolibrary.org/obo/ENVO_00000229>	"intermittent estuary"	"An estuary which varies dramatically in its volume as a result of intermittent freshwater input, and is capable of changing from a wholly marine embayment to any other type of estuary."
<http://purl.obolibrary.org/obo/ENVO_00000532>	"intermittent saline evaporation pond"	
<http://purl.obolibrary.org/obo/ENVO_00000506>	"intermittently filled reservoir"	"A reservoir that is not permanently filled with water, at times being dry."
<http://purl.obolibrary.org/obo/ENVO_00000316>	"intertidal zone"	"The area of the foreshore and seabed that is exposed to the air at low tide and submerged at high tide, i.e., the area between tide marks."
<http://purl.obolibrary.org/obo/ENVO_03000053>	"intraglacial lake"	"A lake which is comprised of meltwater located underneath or within a glacier."
<http://purl.obolibrary.org/obo/ENVO_01001490>	"intrusion"	"A mass of environmental material which has been formed as the result of its transport into an existing mass of another material."
<http://purl.obolibrary.org/obo/ENVO_00000228>	"inverse estuary"	"An estuary which is located in regions where evaporation greatly exceeds the inflow of fresh water, forming a zone of maximum salinity towards which both riverine and marine water masses flow, before sinking and spreading along the bottom in both seaward and landward directions."
<http://purl.obolibrary.org/obo/ENVO_01000507>	"iron sheet"	"An iron sheet is a mass of iron which has been forged into a roughly planar form of less than 6 millimetres in thickness."
