?class	?label	?definition
<http://purl.obolibrary.org/obo/ENVO_01000255>	"mineral deposit"	"A mineral deposit is a physiographic feature which has unusually high concentrations of one or more minerals."
<http://purl.obolibrary.org/obo/ENVO_00000125>	"mineral spring"	"A spring which  water contains a significant amount of dissolved minerals, that derive from the rocks through which the water flows."
<http://purl.obolibrary.org/obo/ENVO_00000536>	"moatan"	"An annular depression that may not be continuous, located at the base of many seamounts, islands, and other isolated elevations."
<http://purl.obolibrary.org/obo/ENVO_03501157>	"mobile intensive care ambulance"	"An ambulance which is equiped to enable intensive care service provision."
<http://purl.obolibrary.org/obo/ENVO_01000581>	"mobile phone"	"A mobile phone is a telephone which transmits sound information to a mobile phone network via radio transmissions."
<http://purl.obolibrary.org/obo/ENVO_03600083>	"mofetta"	"A geological fracture, found near volacnoes in the final phase of thier activity, chiefly discharging carbon dioxide and possibly other vapors."
<http://purl.obolibrary.org/obo/ENVO_00000432>	"monadnock"	"An isolated hill, knob, ridge, or small mountain that rises abruptly from a gently sloping or virtually level surrounding plain."
<http://purl.obolibrary.org/obo/ENVO_00000355>	"monogenetic volcanic field"	"A volcanic field of small, scattered volcanic vents. These volcanic fields, containing numerous monogenetic volcanoes, are noted for having only one short eruptive event. Monogenetic fields occur only where the magma supply to the volcano is low or where vents are not close enough or large enough to develop plumbing systems for continuous feeding of magma."
<http://purl.obolibrary.org/obo/ENVO_01000288>	"monomictic lake"	"A monomictic  lake is a holomictic lake which mixes from top to bottom during one mixing period each year."
<http://purl.obolibrary.org/obo/ENVO_00000177>	"moraine"	"An accumulation of boulders, stones, or other debris carried and deposited by a glacier."
<http://purl.obolibrary.org/obo/ENVO_01000610>	"motor"	"A motor is a machine designed to convert one or more forms of energy into mechanical energy."
<http://purl.obolibrary.org/obo/ENVO_01000609>	"motor boat"	"A motor boat is a boat which is propelled by a motor."
<http://purl.obolibrary.org/obo/ENVO_03510005>	"motor oil"	"A lubricant for internal combustion engines which 1) reduces friction and wear 2) cleans the engine 3) neutralizes acids 4) improves sealing of piston rings, and 5) cools the engine."
<http://purl.obolibrary.org/obo/ENVO_01000601>	"motor vehicle"	"A motor vehicle is a vehicle which is propelled by an engine or motor and that does not operate on rails."
<http://purl.obolibrary.org/obo/ENVO_01000615>	"motorcycle"	"A motorcycle is a two- or three-wheeled motor vehicle."
<http://purl.obolibrary.org/obo/ENVO_01000616>	"motorscooter"	"A scooter or motor scooter is a motorcycle with step-through frame and a platform for the rider's feet."
<http://purl.obolibrary.org/obo/ENVO_00000180>	"mound"	"A rounded elevated area."
<http://purl.obolibrary.org/obo/ENVO_00000477>	"mount"	"A mountain or a hill."
<http://purl.obolibrary.org/obo/ENVO_00000081>	"mountain"	"A landform that extends above the surrounding terrain in a limited area."
<http://purl.obolibrary.org/obo/ENVO_00000084>	"mountain pass"	"A lower point that allows easier access through a mountain range. A pass has the general form of a saddle between two mountains."
<http://purl.obolibrary.org/obo/ENVO_00000080>	"mountain range"	"A range of mounts which is dominated by mountains."
<http://purl.obolibrary.org/obo/ENVO_00000390>	"mountain spur"	"A spur which is part of a mountain."
<http://purl.obolibrary.org/obo/ENVO_00000479>	"mouth"	"The exit or point of discharge of a stream into another stream, lake or sea."
<http://purl.obolibrary.org/obo/ENVO_01000864>	"mouth of liquid discharge conduit"	"A site at the terminus of a liquid conveyance conduit where the liquid carried is discharged into the sea or a river."
<http://purl.obolibrary.org/obo/ENVO_00000402>	"mud volcano"	"A volcano created by geologically excreted liquids and gases, although there are several different processes which may cause such activity. Temperatures are much cooler than igneous processes."
<http://purl.obolibrary.org/obo/ENVO_01001386>	"mussel reef"	"A marine reef which is primarily composed of self-adhered or conglomerated mussel shells."
<http://purl.obolibrary.org/obo/ENVO_03510035>	"naphtha"	"A flammable liquid hydrocarbon mixture produced from natural gas condensates, petroleum distillates, and the distillation of coal tar and peat."
<http://purl.obolibrary.org/obo/ENVO_00000414>	"natural arch"	"A natural formation where a rock arch forms, with a natural passageway through underneath."
<http://purl.obolibrary.org/obo/ENVO_00000465>	"natural harbor"	"A harbor which is formed by a natural landform where a part of a body of water is protected and deep enough to furnish anchorage."
<http://purl.obolibrary.org/obo/ENVO_01001022>	"natural lake"	"A lake which has formed as the result of processes that are not or are only minimally driven by human activity."
<http://purl.obolibrary.org/obo/ENVO_02000151>	"natural nuclear fission reactor"	"A uranium deposit where self-sustaining nuclear chain reactions have occurred."
<http://purl.obolibrary.org/obo/ENVO_00000048>	"navigation canal"	"Artificial watercourse with no flow or a controlled flow used navigation."
<http://purl.obolibrary.org/obo/ENVO_01001380>	"neritic mussel reef"	"A marine reef which is located on a shelf (i.e. in the neritic zone) and primarily composed of self-adhered or conglomerated mussel shells."
<http://purl.obolibrary.org/obo/ENVO_00002181>	"neutral hot spring"	"A neutral spring through which groundwater, heated by geothermal energy, flows."
<http://purl.obolibrary.org/obo/ENVO_01001897>	"neutral spring"	"A spring through which water with a neutral pH flows."
<http://purl.obolibrary.org/obo/ENVO_00000560>	"nuclear weapons test site"	"A weapons test site at which nuclear weapons are, or have been, tested."
<http://purl.obolibrary.org/obo/ENVO_00000181>	"nunatak"	"The exposed summit of a ridge, mountain, or peak not covered with ice or snow within an ice field or glacier. The term is typically used in areas where a permanent ice mass is present."
<http://purl.obolibrary.org/obo/ENVO_03501215>	"nurse call button"	"A switch which allows patients in health care settings to alert a nurse or other health care staff member."
<http://purl.obolibrary.org/obo/ENVO_00000493>	"obsequent stream"	"A stream flowing in the opposite direction of the consequent drainage."
<http://purl.obolibrary.org/obo/ENVO_00000015>	"ocean"	"A marine water body which is constitutes the majority of an astronomical body's hydrosphere."
<http://purl.obolibrary.org/obo/ENVO_00002450>	"ocean basin"	"A structural basin that is below sea level."
<http://purl.obolibrary.org/obo/ENVO_01000651>	"ocean strait"	"An ocean strait is a strait which connects two oceans."
<http://purl.obolibrary.org/obo/ENVO_00000275>	"ocean trench"	"Hemispheric-scale long but narrow topographic depressions of the sea floor. They are the deepest parts of the ocean floor."
<http://purl.obolibrary.org/obo/ENVO_01001381>	"oceanic mussel reef"	"A marine reef which is present in the depths beyond (offshore relative to) the continental shelf and primarily composed of self-adhered or conglomerated mussel shells."
<http://purl.obolibrary.org/obo/ENVO_03510028>	"oil paint thinner"	"A solvent used to thin oil-based paints or clean up after their use."
<http://purl.obolibrary.org/obo/ENVO_00002185>	"oil reservoir"	"A subsurface landform which contains fluid hydrocarbons in porous or fractured rock formations."
<http://purl.obolibrary.org/obo/ENVO_00002063>	"oil seep"	"The result of the release of natural hydrocarbons to the surface of the earth, including beneath the sea, by natural geological processes."
<http://purl.obolibrary.org/obo/ENVO_00002061>	"oil spill"	"The result of the unintentional release of liquid petroleum hydrocarbon into the environment as a result of human activity."
<http://purl.obolibrary.org/obo/ENVO_00002183>	"oil tank"	"A manufactured container within which oil or other petrochemical products are stored and which these products are usually transported to end users or further storage facilities."
<http://purl.obolibrary.org/obo/ENVO_01000003>	"oil well"	"A well which has been drilled in order to extract petroleum oil from subterranean reservoirs and bring it to the surface."
<http://purl.obolibrary.org/obo/ENVO_01000774>	"oligotrophic lake"	"A lake which has nutrient-poor water."
<http://purl.obolibrary.org/obo/ENVO_01000302>	"outcrop"	"A portion of environmental material which protrudes through a surface layer."
<http://purl.obolibrary.org/obo/ENVO_00000324>	"outflow cave"	"A cave from which a stream flows or formerly did so and which cannot be followed upstream to the surface."
<http://purl.obolibrary.org/obo/ENVO_00000434>	"outwash fan"	"A fan-shaped body of sediments deposited by braided streams from a melting glacier."
<http://purl.obolibrary.org/obo/ENVO_00000202>	"oxbow lake"	"A lake which is formed when a wide meander from a stream or a river is cut off to form a lake. They are called oxbow lakes due to the distinctive curved shape that results from this process."
<http://purl.obolibrary.org/obo/ENVO_01001076>	"oxic lake"	"A lake which is primarily composed of oxic water."
<http://purl.obolibrary.org/obo/ENVO_03501364>	"packaging equipment"	"A manufacturing equipment piece which is used to package material."
<http://purl.obolibrary.org/obo/ENVO_03501269>	"packaging machine"	"A device used in packaging operations."
<http://purl.obolibrary.org/obo/ENVO_00000297>	"paddy field"	"A flooded parcel of arable land used for growing rice and other semiaquatic crops."
<http://purl.obolibrary.org/obo/ENVO_03510025>	"paint thinner"	"A solvent that can dissolve paint and reduce viscosity of paint or \"thin\" it."
<http://purl.obolibrary.org/obo/ENVO_03501268>	"pallet"	"A manufactured product which is a flat transport structure that supports goods in a stable fashion while being lifted and/or moved."
<http://purl.obolibrary.org/obo/ENVO_03510012>	"paper dye"	"Dyes used for the coloration or brightening of paper."
<http://purl.obolibrary.org/obo/ENVO_00003895>	"paper product"	"A product which is composed primarily of paper."
<http://purl.obolibrary.org/obo/ENVO_01000561>	"paraffin lamp"	"A paraffin lamp is a type of lighting device which burns paraffin to generate light and heat."
<http://purl.obolibrary.org/obo/ENVO_01000567>	"paraffin lantern"	"A paraffin lantern is a lantern which houses a parrafin lamp in a structure of soldered or crimped-together sheet metal stampings and glass or other translucent material."
<http://purl.obolibrary.org/obo/ENVO_00000562>	"park"	"A bounded area of land, or water, usually in its natural or semi-natural (landscaped) state and set aside for some purpose, usually to do with recreation or conservation."
<http://purl.obolibrary.org/obo/ENVO_01001781>	"part of a landmass"	"A solid astronomical body part which is part of the landmass of that body."
<http://purl.obolibrary.org/obo/ENVO_03501108>	"passenger train"	"A train which is capable of and used for passenger transport."
<http://purl.obolibrary.org/obo/ENVO_00000487>	"paternoster lake"	"One of a series of glacial lakes connected by a single stream or a braided stream system."
<http://purl.obolibrary.org/obo/ENVO_00000480>	"peak"	"The summit of a mount."
<http://purl.obolibrary.org/obo/ENVO_00000157>	"peat cut"	"An artificial working of peatland to remove the peat."
<http://purl.obolibrary.org/obo/ENVO_01000820>	"pedosphere"	"An astronomical body part which is composed of soil, subject to soil formation processes, and found on the surface of a lithosphere."
<http://purl.obolibrary.org/obo/ENVO_03501267>	"peeler"	"A hand tool used to remove the outer layer of vegetables and fruit, consisting of a handle attached to a metal blade with a slot with a sharp edge."
<http://purl.obolibrary.org/obo/ENVO_00000305>	"peninsula"	"A body of land jutting out into and nearly surrounded by water."
<http://purl.obolibrary.org/obo/ENVO_00000460>	"penplain"	"A region of low topographic relief as a consequence of erosion by streams."
<http://purl.obolibrary.org/obo/ENVO_00000200>	"periglacial lake"	"A lake, part of whose margin is formed by an ice mass, ice cap or glacier, the ice having obstructed the natural drainage of the land."
<http://purl.obolibrary.org/obo/ENVO_03000089>	"permafrost crater derived from a methane explosion"	"A crater which is found in permafrost and formed as a result of an explosion fuelled by methane formerly contained in that permafrost."
<http://purl.obolibrary.org/obo/ENVO_00000205>	"permanent spring"	"A spring whose flow is continuous."
<http://purl.obolibrary.org/obo/ENVO_01000923>	"petting zoo"	"A petting zoo is a zoological garden which contains domesticated non-human animals and some wild non-human animals that are docile enough for humans to touch and feed."
<http://purl.obolibrary.org/obo/ENVO_01000736>	"phacolith"	"A phacolith is an intrusion parallel to the bedding plane or foliation of folded country rock. More specifically, it is a typically lens-shaped intrusion that occupies either the crest of an anticline or the trough of a syncline."
<http://purl.obolibrary.org/obo/ENVO_03600077>	"photobioreactor"	"A bioreactor which utilizes a light source to cultivate phototrophic microorganisms."
<http://purl.obolibrary.org/obo/ENVO_01000821>	"photosphere"	"An astronomical body part which is composed of those parts of a star, distal from the star's core, from which light is radiated into space."
<http://purl.obolibrary.org/obo/ENVO_01000866>	"photovoltaic system"	"A photovoltaic system is a power system designed to supply usable solar power by means of photovoltaics. It consists of an arrangement of several components, including solar panels to absorb and convert sunlight into electricity, a solar inverter to change the electric current from DC to AC, as well as mounting, cabling and other electrical accessories to set up a working system."
<http://purl.obolibrary.org/obo/ENVO_00000329>	"phreatic zone"	"A compound astronomical body part which is located beneath the land surface and in which all interstices are filled with water that has a hydraulic head greater than atmospheric pressure due to the weight of overlying groundwater."
<http://purl.obolibrary.org/obo/ENVO_01000587>	"piece of furniture"	"A piece of furniture is a movable object intended to support various human activities such as seating (e.g., chairs, stools and sofas) and sleeping (e.g., beds)."
<http://purl.obolibrary.org/obo/ENVO_00000413>	"pingo"	"A mound of earth-covered ice found in the Arctic, subarctic, and Antarctica that can reach up to 70 metres in height and up to 2 kilometres in diameter."
<http://purl.obolibrary.org/obo/ENVO_01000278>	"pingo scar"	"A depression caused by the collapse of a pingo."
<http://purl.obolibrary.org/obo/ENVO_00000481>	"pinnacle"	"A tall, slender, spire-shaped rock projecting from a level or more gently sloping surface."
<http://purl.obolibrary.org/obo/ENVO_01001871>	"pit"	"A depression in the ground resembling a hole or cavity, either natural or anthropogenic."
<http://purl.obolibrary.org/obo/ENVO_01000517>	"pit latrine"	"A pit latrine is a latrine which is constructed by digging a hole in the ground."
<http://purl.obolibrary.org/obo/ENVO_01000523>	"pit latrine with slab floor"	"A pit latrine with a slab floor is a pit latrine which has a latrine slab as a floor."
<http://purl.obolibrary.org/obo/ENVO_01000976>	"pitfall trap"	"An animal trap which consists of a container set flush with the ground such that animals moving along the ground may fall in and be available for examination or collection."
<http://purl.obolibrary.org/obo/ENVO_00000086>	"plain"	"A region of general uniform slope, comparatively level, and of considerable extent."
<http://purl.obolibrary.org/obo/ENVO_03000144>	"planetary cryosphere"	"A cryosphere which is part of a planet."
<http://purl.obolibrary.org/obo/ENVO_01000822>	"planetary photic zone"	"A planetary part which is exposed, at least periodically, to light."
<http://purl.obolibrary.org/obo/ENVO_03600045>	"plant pot"	"A manufactured product which is designed to function as a container for growing plants."
<http://purl.obolibrary.org/obo/ENVO_06105106>	"plastisphere"	"A part of an astronomical body which includes, as parts, all the entities which are composed primarily of plastic and which are within the gravitational sphere of influence of that body."
<http://purl.obolibrary.org/obo/ENVO_00000182>	"plateau"	"An elevated and comparatively level expanse of land."
<http://purl.obolibrary.org/obo/ENVO_03500001>	"playground"	"A park which has been designed for the recreation of children."
<http://purl.obolibrary.org/obo/ENVO_01000924>	"plumbing drain"	"An artificial channel which transports unwanted water or waste liquids away from their source, either to a more useful area, a receptacle, or into sewers or stormwater mains as waste discharge to be released or processed."
<http://purl.obolibrary.org/obo/ENVO_01000989>	"plumbing fixture"	"An exchangeable device which can be connected to a plumbing system to deliver and drain water."
<http://purl.obolibrary.org/obo/ENVO_01001743>	"plume"	"A fluid astronomical body part which is plume shaped."
<http://purl.obolibrary.org/obo/ENVO_00000483>	"plunge pool"	"A hollow eroded by the force of the falling water at the base of a waterfall, particularly by the eddying effect."
<http://purl.obolibrary.org/obo/ENVO_02000003>	"pockmark field"	"A pockmark field is an undersea feature formed by shallow seabed depressions, typically several tens of metres across and a few metres deep. Generally, they are formed in soft, fine-grained seabed sediments by the escape of fluids (gas or water, but mainly methane) into the water column."
<http://purl.obolibrary.org/obo/ENVO_01001454>	"polar mountain"	"A mountain that is part of a polar environment."
<http://purl.obolibrary.org/obo/ENVO_00000286>	"polder"	"An area reclaimed from the sea by diking and draining."
<http://purl.obolibrary.org/obo/ENVO_00000325>	"polje"	"A large closed depression draining underground, with a flat floor across which there may be an intermittent or perennial stream and which may be liable to flood and become a lake. The floor makes a sharp break with parts of surrounding slopes."
<http://purl.obolibrary.org/obo/ENVO_01000680>	"polluted lake"	"A lake which has concentrations of environmental contaminants high enough to harm the ecosystems associated with it."
<http://purl.obolibrary.org/obo/ENVO_03600015>	"polluted river"	"A river which has elevated levels of contaminants."
<http://purl.obolibrary.org/obo/ENVO_00000462>	"polygenetic volcanic field"	"A volcanic field of scattered volcanic vents. These volcanic fields, containing numerous polygenetic volcanoes, are noted for having more than one eruptive event from the same vent(s), rather than the more common monogenetic volcanic field. Polygenetic volcanic fields generally occur where there is a high-level magma chamber. These volcanic fields may show lithological discontinuities due to major changes in magma chemistry, volcanotectonic events, or long erosional intervals, and may last >10 million year period."
<http://purl.obolibrary.org/obo/ENVO_00000335>	"polygonal karst"	"Karst completely pitted by closed depressions so that divides between them form a crudely polygonal network."
<http://purl.obolibrary.org/obo/ENVO_01000287>	"polymictic lake"	"A polymictic lake is a holomictic lake which is too shallow to allow thermal stratification and which can mix from top to bottom through the ice-free period of the year."
<http://purl.obolibrary.org/obo/ENVO_00000033>	"pond"	"A body of water, usually of smaller size than a lake."
<http://purl.obolibrary.org/obo/ENVO_01000535>	"pour-flush pit latrine"	"A pit latrine which includes a water seal (U-trap or siphon) used over one or two offset pits instead of a plain hole or seat. Water is manually poured through the trap to flush excreta into the latrine pit."
<http://purl.obolibrary.org/obo/ENVO_01000534>	"pour-flush toilet fixture"	"A flush toilet fixture into which water is manually poured to dispose of excreta."
<http://purl.obolibrary.org/obo/ENVO_01000597>	"pressure lamp"	"A pressure lamp is a portable paraffin or oil lamp in which fuel is forced up into the mantle or burner by air pressure in the reservoir, which can be increased by pumping with a plunger."
<http://purl.obolibrary.org/obo/ENVO_01000361>	"primary cave"	"A cave formed at the same time as the surrounding rock."
<http://purl.obolibrary.org/obo/ENVO_03600046>	"processed tobacco"	"A manufactured product which is produced by curing, subsequent aging, slow oxidation and degradation of carotenoids in tobacco leaves."
<http://purl.obolibrary.org/obo/ENVO_00000435>	"proglacial lake"	"A lake formed either by the damming action of a moraine or ice dam during the retreat of a melting glacier, or one formed by meltwater trapped against an ice mass due to isostatic depression of the crust around the ice."
<http://purl.obolibrary.org/obo/ENVO_00000461>	"pseudocrater"	"A volcanic landform which resembles a true volcanic crater, but differs in that it is not an actual vent from which lava has erupted. A pseudocrater is characterised by the absence of any magma conduit which connects below the surface of the earth. Pseudocraters are formed by steam explosions as flowing hot lava crosses over a wet surface, such as a swamp, a lake, or a pond. The explosive gases break through the lava surface in a manner similar to a phreatic eruption, and the tephra builds up crater-like forms which can appear very similar to real volcanic craters."
<http://purl.obolibrary.org/obo/ENVO_03501112>	"public bus"	"A bus which is part of public infrastructure."
<http://purl.obolibrary.org/obo/ENVO_03501113>	"public ferry"	"A ferry which is owned by a government or other form of public representation."
<http://purl.obolibrary.org/obo/ENVO_03500002>	"public park"	"A park which is owned by a governmental or state entity and which is accessible by its citizenry (i.e. the public)."
<http://purl.obolibrary.org/obo/ENVO_03501115>	"public subway train"	"A subway train which is owned by a government or other form of public representation."
<http://purl.obolibrary.org/obo/ENVO_03501114>	"public train"	"A train which is owned by a government or other form of public representation."
<http://purl.obolibrary.org/obo/ENVO_01000783>	"public utility line"	"A utility line which services the public power grid."
<http://purl.obolibrary.org/obo/ENVO_01000871>	"puddle of water"	"A puddle is a small accumulation of water, on a surface. It can form either by pooling in a depression on the surface, or by surface tension upon a flat surface."
<http://purl.obolibrary.org/obo/ENVO_03501266>	"pump"	"A device that moves fluids (liquids or gases), or sometimes slurries, by mechanical action."
<http://purl.obolibrary.org/obo/ENVO_00002195>	"pyritic acid mine drainage"	
<http://purl.obolibrary.org/obo/ENVO_00000356>	"pyroclastic cone"	"A cone made of material ejected from a volcano. The material can range from finest particles. In comparison, cinder cones are more uniform. They are usually found in or on larger features, such as stratovolcanoes, shield volcanoes and can be found inside calderas, however they can also be an independent feature. They can range from a few metres in height and are usually formed by a single eruption."
<http://purl.obolibrary.org/obo/ENVO_00000372>	"pyroclastic shield volcano"	"A shield volcano that is formed mostly of pyroclastic and highly explosive eruptions rather than relatively fluid basaltic lava issuing from vents or fissures on the surface of the volcano. They typically display low-angle flank slopes and have little or no central collapse, although a shallow sag in the shield is commonly observed. Lava is commonly extruded after the cessation of explosive activity commonly superposes the vent region."
<http://purl.obolibrary.org/obo/ENVO_03600047>	"raceway pond"	"A pond which humans have constructed for the cultivation of algae."
<http://purl.obolibrary.org/obo/ENVO_01000577>	"radio device"	"A device capable of receiving and/or transmitting information encoded in electromagnetic radiation through wave modulation."
<http://purl.obolibrary.org/obo/ENVO_01001896>	"radioactive spring"	"A mineral spring through which water with elevated levels of radioactive material flows."
<http://purl.obolibrary.org/obo/ENVO_00000415>	"raised beach"	"A beach or wave cut platform raised above the shore line by a relative fall in the sea level."
<http://purl.obolibrary.org/obo/ENVO_00000478>	"range of mounts"	"A field which includes at least two mounts connected by high ground and arranged in an approximately linear fashion."
<http://purl.obolibrary.org/obo/ENVO_00000550>	"range of seamounts"	"A mountain range which is submerged under a marine water body."
<http://purl.obolibrary.org/obo/ENVO_01000446>	"ravine"	"A ravine is a small, narrow, steep-sided valley that is larger than a gully and smaller than a canyon and that is usually worn by running water."
<http://purl.obolibrary.org/obo/ENVO_03501104>	"recreational cruise ship"	"A boat which provides short-term residential and entertainment facilities to passengers."
<http://purl.obolibrary.org/obo/ENVO_01001899>	"reef"	
