?class	?label	?definition
<http://purl.obolibrary.org/obo/ENVO_00000036>	"irrigation canal"	"Artificial watercourse with no flow or a controlled flow used irrigation."
<http://purl.obolibrary.org/obo/ENVO_00000139>	"irrigation ditch"	"A ditch that supplies water to surrounding land."
<http://purl.obolibrary.org/obo/ENVO_00000450>	"irrigation reservoir"	"A reservoir constructed for the purpose of providing water for irrigation."
<http://purl.obolibrary.org/obo/ENVO_00000353>	"island arc"	"A volcanic arc formed by the subduction of oceanic crust other oceanic crust on an adjacent tectonic plate."
<http://purl.obolibrary.org/obo/ENVO_00000174>	"isthmus"	"Narrow section of land in a body of water connecting two larger land areas."
<http://purl.obolibrary.org/obo/ENVO_00000321>	"joint-plane cave"	"A cavity developed along a joint and elongate in cross-section."
<http://purl.obolibrary.org/obo/ENVO_00000542>	"kame"	"An irregularly shaped hill or mound composed of sorted or stratified sand and gravel that is deposited in contact with the glacial ice. It can have an irregular shape. Kames are often associated with kettles, and this is referred to as kame and kettle topography. When the ice retreats further, the delta kame often collapses. Kame terraces are frequently found along the side of a glacial valley and are the deposits of meltwater streams flowing between the ice and the adjacent valley side."
<http://purl.obolibrary.org/obo/ENVO_00000433>	"kame terrace"	"A terrace associated with a kame."
<http://purl.obolibrary.org/obo/ENVO_00000175>	"karst"	"A surface landform which is formed by the dissolution of a soluble layer or layers of bedrock."
<http://purl.obolibrary.org/obo/ENVO_00012411>	"karst cave"	"A cave which is part of a karst formation."
<http://purl.obolibrary.org/obo/ENVO_00004683>	"karst field"	"A large flat plain in karst territory with areas usually 5 to 400 sqaure kilometres."
<http://purl.obolibrary.org/obo/ENVO_01000058>	"kelp forest"	"Kelp forests are underwater areas with a high density of kelp. They are recognized as one of the most productive and dynamic ecosystems on Earth. Smaller areas of anchored kelp are called kelp beds."
<http://purl.obolibrary.org/obo/ENVO_00000311>	"kettle"	"A fluvioglacial landform occurring as the result of blocks of ice calving from the front of a receding glacier and becoming partially to wholly buried by glacial outwash. Glacial outwash is generated when sediment laden streams of meltwater flow away from the glacier and are deposited to form broad outwash plains called sandurs. When the ice blocks melt, holes are left in the sandur."
<http://purl.obolibrary.org/obo/ENVO_00000410>	"kipuka"	"An elevated area such as a hill, ridge or old lava dome inside or downslope from an area of active volcanism. New lava flows will cover the surrounding land, isolating the kipuka so that it appears as a (usually) forested island in a barren lava flow."
<http://purl.obolibrary.org/obo/ENVO_01000734>	"laccolith"	"A sheet intrusion (or concordant pluton) that has been injected between two layers of sedimentary rock. The pressure of the magma is high enough that the overlying strata are forced upward, giving the laccolith a dome or mushroom-like form with a generally planar base."
<http://purl.obolibrary.org/obo/ENVO_03510024>	"lacquer"	"A category of hard and potentially shiny (clear or colored) finishes which can be applied to materials including wood or metal."
<http://purl.obolibrary.org/obo/ENVO_00000093>	"lacustrine beach"	"A beach which is part of a lake shore."
<http://purl.obolibrary.org/obo/ENVO_00000259>	"lacustrine plain"	"A plain that originally formed in a lacustrine environment, that is, as the bed of a lake, but from which the water has disappeared, by natural drainage, evaporation or other geophysical processes."
<http://purl.obolibrary.org/obo/ENVO_00000020>	"lake"	"A body of water or other liquid of considerable size contained in a depression on a landmass."
<http://purl.obolibrary.org/obo/ENVO_00000397>	"lake channel"	"A channel of a watercourse which contains lake water."
<http://purl.obolibrary.org/obo/ENVO_00000476>	"lake inlet"	"An opening of a lake into its shore."
<http://purl.obolibrary.org/obo/ENVO_00000382>	"lake shore"	"That part of the land in immediate contact with a lake."
<http://purl.obolibrary.org/obo/ENVO_01001074>	"lake with a hypoxic hypolimnion"	"A lake which has a hypolimnion composed primarily of hypoxic water."
<http://purl.obolibrary.org/obo/ENVO_01001073>	"lake with an anoxic hypolimnion"	"A lake which has a hypolimnion composed primarily of anoxic water."
<http://purl.obolibrary.org/obo/ENVO_01001077>	"lake with an oxic hypolimnion"	"A lake which has a hypolimnion composed primarily of oxic water."
<http://purl.obolibrary.org/obo/ENVO_01000566>	"lamp"	"A lamp is an object which generates heat, light, or any other form of radiation."
<http://purl.obolibrary.org/obo/ENVO_00000391>	"land bridge"	"An isthmus or other land connection between what at other times are separate land masses which allows animals and plants to cross and colonise new lands. Land bridges are commonly created by regression, in which sea levels fall exposing previously submerged sections of continental shelf. Land bridges are also formed by: (a) upthrust at the edge of continental plates; and (b) glacial retreat alleviating pressure on shallow marine formations."
<http://purl.obolibrary.org/obo/ENVO_00000533>	"landfill"	"A depression which contains objects and materials discarded by humans or their technologies."
<http://purl.obolibrary.org/obo/ENVO_01001886>	"landform"	"A solid astronomical body part which has been formed from and is composed primarily of the matter of that astronomical body."
<http://purl.obolibrary.org/obo/ENVO_01000582>	"landline telephone"	"A landline telephone is a telephone which is connected to a telephone network with wires through which electronic signals are carried."
<http://purl.obolibrary.org/obo/ENVO_00000219>	"landlocked sea"	"A sea that is not connected with an ocean."
<http://purl.obolibrary.org/obo/ENVO_00000520>	"landslide"	"A mound of earth material, at the base of a slope and the associated scoured area."
<http://purl.obolibrary.org/obo/ENVO_01001106>	"landslide lake"	"A lake which fills a depression where drainage is blocked by solid material transported by a landslide."
<http://purl.obolibrary.org/obo/ENVO_01000565>	"lantern"	"A lantern is a portable device or mounted fixture comprising a light source protected by a translucent case."
<http://purl.obolibrary.org/obo/ENVO_00000249>	"lateral moraine"	"The parallel ridges of till deposited along the sides of an alglacier. The unconsolidated debris is deposited on top of the glacier by frost shattering of the valley walls and from tributary streams flowing into the valley. The till is carried along the glacial margin until the glacier melts."
<http://purl.obolibrary.org/obo/ENVO_01000519>	"latrine"	"A latrine is a toilet which is of simple construction (relative to a flush or chemical toilet) and typically intended for communal use."
<http://purl.obolibrary.org/obo/ENVO_01000522>	"latrine pit"	"A latrine pit is an artificial hole or cavity in the ground used to collect human excreta."
<http://purl.obolibrary.org/obo/ENVO_01000520>	"latrine slab"	"A latrine slab is a  broad, flat, thick piece of solid material (typically stone or concrete) used as the floor of a latrine and which includes a hole through which excreta are deposited into a latrine pit."
<http://purl.obolibrary.org/obo/ENVO_01000437>	"lava field"	"A lava field is an expanse of flat-lying lava flows. Such features are generally composed of highly fluid basalt lava, and can extend for tens or even hundreds of miles across the underlying terrain."
<http://purl.obolibrary.org/obo/ENVO_01000438>	"lava flow"	"A lava flow is a moving outpouring of lava, which is created during a non-explosive effusive eruption."
<http://purl.obolibrary.org/obo/ENVO_00000110>	"lava tunnel"	"A tunnel formed by the flow of molten lava, which has subsequently drained out."
<http://purl.obolibrary.org/obo/ENVO_00000544>	"leat"	"A man-made watercourse, or makeshift aqueduct, often an artificial channel which supplies water to a watermill or its mill pond, collecting water from upstream of the mill so that the natural level of the driving water is above the level of the stream at the mill. Alternatively to may deliver water for mineral washing and concentration, irrigation or to a dye works."
<http://purl.obolibrary.org/obo/ENVO_03510011>	"leather dye"	"Pigments carried by solvents or water which are applied to leather to be absorbed into the pores of the leather to deposit coloration."
<http://purl.obolibrary.org/obo/ENVO_01000617>	"lentic water body"	"A lentic water body is a water body in which the accumulated water, in its totality, has very little to no directed flow."
<http://purl.obolibrary.org/obo/ENVO_01001887>	"letter paper"	"A paper product which has been manufactured to facilitate the writing of letters."
<http://purl.obolibrary.org/obo/ENVO_00000178>	"levee"	"An artificial slope or wall, usually earthen, which parallels the course of a river, built for the purpose of containing the river."
<http://purl.obolibrary.org/obo/ENVO_03501213>	"light switch"	"A switch which turns a light on or off."
<http://purl.obolibrary.org/obo/ENVO_00000453>	"liman"	"A lake or estuary that is formed at the mouth of a river where flow is blocked by a bar of sediments. It can be maritime (the bar being created by the current of a sea) or fluvial (the bar being created by the flow of a bigger river at the confluence)."
<http://purl.obolibrary.org/obo/ENVO_01000359>	"limestone cave"	"A cave formed in limestone, usually by dissolution of limestone by acidic groundwater."
<http://purl.obolibrary.org/obo/ENVO_00000422>	"limestone pavement"	"A natural karst landform consisting of a flat, incised surface of exposed limestone that resembles artificial pavement."
<http://purl.obolibrary.org/obo/ENVO_01001477>	"liquid astronomical body part"	"A part of an astronomical body which is primarily composed of liquid material."
<http://purl.obolibrary.org/obo/ENVO_01001889>	"lithia spring"	"A mineral spring through which water with elevated concentrations of lithium salts flows."
<http://purl.obolibrary.org/obo/ENVO_00000323>	"live cave"	"A cave containing a stream or active speleothems."
<http://purl.obolibrary.org/obo/ENVO_03501214>	"locker"	"A manufactured product which is a storage compartment with a lock."
<http://purl.obolibrary.org/obo/ENVO_01000735>	"lopolith"	"A large igneous intrusion which is lenticular in shape with a depressed central region."
<http://purl.obolibrary.org/obo/ENVO_06105118>	"lost fishing gear"	"Abandoned fishing gear which was unintentionally left unmaintained and uncontrolled by its custodian."
<http://purl.obolibrary.org/obo/ENVO_00000517>	"lost stream"	"A surface stream that disappears into an underground channel, or dries up in an arid area."
<http://purl.obolibrary.org/obo/ENVO_01000618>	"lotic water body"	"A lotic water body is a water body in which the accumulated water, in its totality, is flowing."
<http://purl.obolibrary.org/obo/ENVO_00000319>	"low tide zone"	"The tidal zone that is mostly submerged, only being exposed at the point of low tide and for a longer period of time during extremely low tides."
<http://purl.obolibrary.org/obo/ENVO_00000245>	"maar"	"A broad, low relief crater that results from a phreatic eruption or explosion caused by groundwater contact with hot lava or magma. The maar typically fills with water to form a relatively shallow crater lake."
<http://purl.obolibrary.org/obo/ENVO_00000417>	"machair"	"A fertile low-lying raised beach found on the some of the coastlines of Ireland and Scotland, in particular in the Outer Hebrides."
<http://purl.obolibrary.org/obo/ENVO_01000348>	"maize field"	"A field  used for the cultivation of corn or related crop plants."
<http://purl.obolibrary.org/obo/ENVO_00000066>	"man-made tunnel"	"A tunnel constructed by human means."
<http://purl.obolibrary.org/obo/ENVO_01000564>	"mantle lamp"	"A mantle lamp is a central-draught lamp which includes a pear-shaped, fabric mesh containing thorium or other rare-earth salts placed over the burner. On first use the fabric burns away and the rare-earth salts are converted to oxides, leaving a very fragile structure which incandesces (glows brightly) upon exposure to the heat of the burner flame."
<http://purl.obolibrary.org/obo/ENVO_01000625>	"manufactured cage"	"A manufactured structure made of interspaced structural elements such as metal or wooden bars or wires held together such that they may be used to confine, contain, or protect something."
<http://purl.obolibrary.org/obo/ENVO_06105110>	"manufactured plastisphere"	"A plastisphere which is composed primarily of manufactured plastic."
<http://purl.obolibrary.org/obo/ENVO_00003074>	"manufactured product"	"A material entity that has been processed by humans or their technology in any way, including intermediate products as well as final products."
<http://purl.obolibrary.org/obo/ENVO_03501357>	"manufacturing equipment"	"A manufactured product which is capable of some manufacturing process."
<http://purl.obolibrary.org/obo/ENVO_01001872>	"manure pit"	"A pit which is used for the collection and storage of manure."
<http://purl.obolibrary.org/obo/ENVO_01000072>	"marine Taylor column"	"A marine Taylor column is a Taylor column that is formed in a marine body of water. Currents flowing over shoaling topography such as seamounts are accelerated and destabilised, resulting in Taylor columns. Eddies and internal waves are generated downstream of the topological feature and may extend 1000 m or so above them. This may result in a localised increase in primary production where the Taylor column reaches surface waters."
<http://purl.obolibrary.org/obo/ENVO_01000057>	"marine algal bloom"	"A marine algal bloom is a rapid increase or accumulation in the population of algae in a marine system. Typically, only one or a small number of phytoplankton  species are involved. Although there is no officially recognized threshold level, algae can be considered to be blooming at concentrations of hundreds to thousands of cells per milliliter, depending on the severity."
<http://purl.obolibrary.org/obo/ENVO_01000066>	"marine anoxic zone"	"Marine anoxic zones are areas of marine water that are depleted of dissolved oxygen. This condition is generally found in areas that have restricted water exchange. In most cases, oxygen is prevented from reaching the deeper levels by a physical barrier (sill) as well as by a pronounced density stratification. Anoxic conditions will occur if the rate of oxidation of organic matter by bacteria is greater than the supply of dissolved oxygen."
<http://purl.obolibrary.org/obo/ENVO_00000396>	"marine channel"	"A channel of a watercourse which contains marine water."
<http://purl.obolibrary.org/obo/ENVO_01000108>	"marine cold-water sphere"	"The marine cold-water sphere describes a water mass extending from the polar seas and across low latitudes at depths of ca. 800 to 1000 m, which is separated from the marine warm-water sphere by the permanent marine thermocline"
<http://purl.obolibrary.org/obo/ENVO_01000145>	"marine coral reef back reef"	
<http://purl.obolibrary.org/obo/ENVO_01000148>	"marine coral reef buttress zone"	
<http://purl.obolibrary.org/obo/ENVO_01000146>	"marine coral reef crest"	
<http://purl.obolibrary.org/obo/ENVO_01000149>	"marine coral reef deep fore reef"	
<http://purl.obolibrary.org/obo/ENVO_01000144>	"marine coral reef flat zone"	
<http://purl.obolibrary.org/obo/ENVO_01000147>	"marine coral reef fore reef"	
<http://purl.obolibrary.org/obo/ENVO_01001201>	"marine environmental zone"	"An astronomical body part which is part of a marine environment."
<http://purl.obolibrary.org/obo/ENVO_01000410>	"marine eulittoral zone"	"The eulittoral zone extends from the spring high tide line, which is rarely inundated, to the spring low tide line, which is rarely not inundated. The wave action and turbulence of recurring tides shapes and reforms cliffs, gaps, and caves, offering a huge range of habitats for sedentary organisms."
<http://purl.obolibrary.org/obo/ENVO_01000122>	"marine hydrothermal vent"	"A marine hydrothermal vent is a marine benthic feature where heat generated due to tectonic activity, either at divergent plate boundaries or convergent ocean plates where back-arc spreading occurs, is released or 'vented' to the surface. The resultant high temperature water jets are laden with dissolved metals and minerals."
<http://purl.obolibrary.org/obo/ENVO_01000129>	"marine hydrothermal vent chimney"	"A column of solid material which has been progressively deposited around a hydrothermal vent."
<http://purl.obolibrary.org/obo/ENVO_03600041>	"marine lake"	"A lake which is connected to a marine water body via tunnels or cracks in the soil."
<http://purl.obolibrary.org/obo/ENVO_01000353>	"marine mesoscale eddy field"	"A mesoscale eddy field is an expanse of marine water which includes coherent vortices, as well as a rich cascade of other structures such as filaments, squirts and spirals and is characterized by temperature and salinity anomalies with associated flow anomalies that are nearly in geostrophic balance. Although only the surface expression of mesoscale eddies is visible in satellite images of sea surface height or temperature, they are in fact three dimensional structures that reach down into the pycnocline."
<http://purl.obolibrary.org/obo/ENVO_01000073>	"marine oligotrophic desert"	"A marine water mass which is composed primarily of water with low concentrations of nutrients."
<http://purl.obolibrary.org/obo/ENVO_01000065>	"marine oxygen minimum zone"	"A marine water mass which is characterized by having much lower than normal dissolved oxygen concentrations persistently."
<http://purl.obolibrary.org/obo/ENVO_01000160>	"marine pockmark"	"Pockmarks are craters in the seabed resulting from the release of gas or liquid. Generally, they are formed in soft, fine-grained seabed sediments by the escape of fluids (gas or water, but mainly methane) into the water column."
<http://purl.obolibrary.org/obo/ENVO_01000143>	"marine reef"	"A reef which is located in a marine water body."
<http://purl.obolibrary.org/obo/ENVO_01000161>	"marine sponge reef"	"A marine sponge reef is marine reefs primarily built by marine sponges. The primary frame-building sponges are all members of the order Hexactinosa. They are found only in glacier-scoured troughs of low-angle continental shelf. The seafloor is stable and consists of rock, coarse gravel, and large boulders."
<http://purl.obolibrary.org/obo/ENVO_01000126>	"marine sub-littoral zone"	"The marine sublittoral zone is part of the marine littoral zone which is permanently covered by seawater. In physical oceanography, the sublittoral zone refers to coastal regions with significant tidal flows and energy dissipation, including non-linear flows, internal waves, river outflows and oceanic fronts. In practice, this typically extends to the edge of the continental shelf, with depths around 200 meters. In marine biology, the sublittoral refers to the areas where sunlight reaches the ocean floor, that is, where the water is never so deep as to take it out of the photic zone."
<http://purl.obolibrary.org/obo/ENVO_01000150>	"marine subtidal rocky reef"	"A rocky reef which is located in the subtidal zone of a marine water body."
<http://purl.obolibrary.org/obo/ENVO_01000124>	"marine supra-littoral zone"	"The supralittoral zone is the area above the spring high tide line that is regularly splashed, but not submerged by ocean water. Seawater penetrates these elevated areas only during storms with high tides."
<http://purl.obolibrary.org/obo/ENVO_00000509>	"marine terrace"	"A terrace which is located in a marine water body."
<http://purl.obolibrary.org/obo/ENVO_01001341>	"marine tidal flow zone"	"An environmental zone in which varying gravitational forces from astronomical bodies, combined with the rotation of the astronomical body containing the zone, cause marine waters to undergo periodic depth oscillations (tides)."
<http://purl.obolibrary.org/obo/ENVO_01000109>	"marine warm-water sphere"	"The marine warm-water sphere describes a water mass extending to depths of ca. 800 to 1000 m in low and middle latitudes. It is separated from the marine cold-water sphere by the permanent marine thermocline"
<http://purl.obolibrary.org/obo/ENVO_00001999>	"marine water body"	"A lentic water body which is composed primarily of marine water."
<http://purl.obolibrary.org/obo/ENVO_01000686>	"marine water mass"	"A mass of marine water."
<http://purl.obolibrary.org/obo/ENVO_01000987>	"market"	"A part of an ecosystem where people gather for the purchase and sale of provisions, livestock, and other goods."
<http://purl.obolibrary.org/obo/ENVO_01000457>	"masonry unit"	"A masonry unit is a solid piece of material, usually with a regular shape, used as a component in the construction of buildings. Masonry units are usually composed of brick, stone, marble, granite, travertine, limestone, cast stone, concrete block, glass block, stucco, tile, or cob."
<http://purl.obolibrary.org/obo/ENVO_00000381>	"massif"	"A section of the Earths's crust that is demarcated by faults or flexures. In the movement of the crust, a massif tends to retain its internal structure while being displaced as a whole."
<http://purl.obolibrary.org/obo/ENVO_01000590>	"mattress"	"A mattress is a mass of material which is able to cushion and support a reclining body and is used as or on a bed."
<http://purl.obolibrary.org/obo/ENVO_00000427>	"meander"	"A bend in a stream. A stream flowing through a wide valley or flat plain will tend to form a meanders as it alternatively erodes and deposits sediments along its course."
<http://purl.obolibrary.org/obo/ENVO_00000510>	"meander neck"	"A landform which is the narrowest part of a meander."
<http://purl.obolibrary.org/obo/ENVO_00000250>	"medial moraine"	"A moriane formed when the inside lateral moraines of two glaciers merge together. They form a ridge down the center of the combined glaciers."
<http://purl.obolibrary.org/obo/ENVO_00010621>	"medical instrument"	"A manufactured product which has been designed for use in one or more medical procedures."
<http://purl.obolibrary.org/obo/ENVO_03000040>	"melt pond"	"A water body which forms as a result of localised melting taking place on the surface of a glacier or a mass of sea ice and which is contained in the cavity formed by such melting."
<http://purl.obolibrary.org/obo/ENVO_03600010>	"membrane bioreactor"	"A bioreactor which has a membrane as a part"
<http://purl.obolibrary.org/obo/ENVO_03501105>	"merchant vessel"	"A transport boat which can be hired."
<http://purl.obolibrary.org/obo/ENVO_00000199>	"meromictic lake"	"A lake which has layers of water which do not intermix."
<http://purl.obolibrary.org/obo/ENVO_03600043>	"meromictic pond"	"A pond which has layers of water that do not intermix."
<http://purl.obolibrary.org/obo/ENVO_00000179>	"mesa"	"An elevated area of land with a flat top and sides that are usually steep cliffs. Mesas form in areas where horizontally layered rocks are uplifted by tectonic activity."
<http://purl.obolibrary.org/obo/ENVO_01000620>	"mesocosm"	"A mesocosm is a vivarium that is embedded within a natural environment and is used to place a relatively small part of that environment under experimental control for the purposes of scientific investigation."
<http://purl.obolibrary.org/obo/ENVO_00002128>	"mesophilic sulfur spring"	"A sulfur spring through which water at a temperature optimal for the growth of mesophillic microorganism (approximately 20 to 45 degrees Celsius) flows."
<http://purl.obolibrary.org/obo/ENVO_01000775>	"mesotrophic lake"	"A lake with medium nutrient levels, which allow moderate productivity."
<http://purl.obolibrary.org/obo/ENVO_00000310>	"meteor impact crater"	"A crater caused by the impact of a meteor."
<http://purl.obolibrary.org/obo/ENVO_03000083>	"methane-releasing thermokarst lake"	"A thermokarst lake through which methane gas released from thawing permafrost, or other methane stores, rises and escapes to the atmosphere."
<http://purl.obolibrary.org/obo/ENVO_01000621>	"microcosm"	"A microcosm is a vivarium within which a simple ecosystem is artificially established and used to simulate and predict the behaviour of natural ecosystems under controlled conditions."
<http://purl.obolibrary.org/obo/ENVO_01000674>	"microfracture"	"A microfracture is a small fracture which is found in a portion of solid material along which further fracturing tends to occur. Microfractures are considered imperfections which to pre-exist any fractures formed by the application of stress to a material."
<http://purl.obolibrary.org/obo/ENVO_01001460>	"mid-elevation mountain"	"A mountain which has a maximum elevation between 300 and 2499 metres above sea level and slopes greater than or equal to two degrees of inclination."
<http://purl.obolibrary.org/obo/ENVO_00000406>	"mid-ocean ridge"	"An underwater mountain range, formed by plate tectonics. This uplifting of the ocean floor occurs when convection currents rise in the mantle beneath the oceanic crust and create magma where two tectonic plates meet at a divergent boundary. The mid-ocean ridges of the world are connected and form a single global mid-oceanic ridge system that is part of every ocean."
<http://purl.obolibrary.org/obo/ENVO_00010442>	"midden"	"A dump for domestic waste. A term used to describe any kind of feature containing waste products relating to day-to-day human life."
<http://purl.obolibrary.org/obo/ENVO_00000561>	"military training area"	"A region in which military personnel train."
<http://purl.obolibrary.org/obo/ENVO_00001996>	"mine drainage"	"The outflow of water from a mine."
