?class	?label	?definition
<http://purl.obolibrary.org/obo/ENVO_01001385>	"Bathymodiolus-dominated oceanic mussel reef"	"An oceanic mussel reef which is primarily settled by mussels of the genus Bathymodiolus and primarily composed of self-adhered or conglomerated mussel shells"
<http://purl.obolibrary.org/obo/ENVO_03510014>	"India ink"	"A black or colored ink which is 1) used for writing, printing, and drawing and 2) made from fine soot (lampblack) and water."
<http://purl.obolibrary.org/obo/ENVO_01001109>	"Karman vortex street"	"A succession of swirling vortices caused by the unsteady separation of flow of a fluid around one or more blunt bodies."
<http://purl.obolibrary.org/obo/ENVO_00000437>	"Nye channel"	"A small tunnel valley."
<http://purl.obolibrary.org/obo/ENVO_01000299>	"Taylor column"	"A Taylor column is a column of deflected fluid flow which is formed in a perturbed, rotating fluid, is parallel to the axis of rotation, and extends above the obstacle perturbing the fluid in a rigid manner."
<http://purl.obolibrary.org/obo/ENVO_01001461>	"UNEP-WCMC class 1 mountain"	"A high-elevation mountain which has a maximum elevation greater than 4500 metres above sea level."
<http://purl.obolibrary.org/obo/ENVO_01001462>	"UNEP-WCMC class 2 mountain"	"A high-elevation mountain which has a maximum elevation between 3500 and 4500 metres above sea level."
<http://purl.obolibrary.org/obo/ENVO_01001463>	"UNEP-WCMC class 3 mountain"	"A high-elevation mountain which has a maximum elevation between 2500 and 3500 metres above sea level."
<http://purl.obolibrary.org/obo/ENVO_01001464>	"UNEP-WCMC class 4 mountain"	"A mid-elevation mountain which has a maximum elevation between 1500 and 2499 metres above sea level and a slope greater than or equal to two degrees."
<http://purl.obolibrary.org/obo/ENVO_01001465>	"UNEP-WCMC class 5 mountain"	"A mid-elevation mountain which has a maximum elevation between 1000 and 1499 metres above sea level and either 1) a slope greater than or equal to five degrees or 2) a local elevation range, within a 7 kilometre radius, of greater than 300 metres above sea level."
<http://purl.obolibrary.org/obo/ENVO_01001466>	"UNEP-WCMC class 6 mountain"	"A mid-elevation mountain which has a maximum elevation between 300 and 999 metres above sea level and a local elevation range, within a 7 kilometre radius, of greater than 300 metres above sea level."
<http://purl.obolibrary.org/obo/ENVO_01001467>	"UNEP-WCMC class 7 mountain"	"An elevated inner basin or plateau surrounded by mountains, but not - itself - a mountain."
<http://purl.obolibrary.org/obo/ENVO_06105117>	"abandoned fishing gear"	"Fishing gear which is not under the control of or maintained by its custodian."
<http://purl.obolibrary.org/obo/ENVO_00000524>	"abandoned watercourse"	"A former stream or distributary no longer carrying flowing water, but still evident due to lakes, wetland, topographic or vegetation patterns."
<http://purl.obolibrary.org/obo/ENVO_00000190>	"abyssal feature"	"Feature on the ocean floor at a depth of 3500 - 6000 meters."
<http://purl.obolibrary.org/obo/ENVO_00000244>	"abyssal plain"	"A flat or very gently sloping areas of the deep ocean basin floor."
<http://purl.obolibrary.org/obo/ENVO_00001997>	"acid mine drainage"	"A mine drainage with an acidic pH."
<http://purl.obolibrary.org/obo/ENVO_00002120>	"acidic hot spring"	"An acidic spring through which groundwater, heated by geothermal energy, flows."
<http://purl.obolibrary.org/obo/ENVO_01001898>	"acidic spring"	"A spring through which water with a low pH flows."
<http://purl.obolibrary.org/obo/ENVO_03510026>	"acrylic paint medium"	"A liquid, gel, or paste that can be mixed into acrylic paint to alter paint consistency and properties."
<http://purl.obolibrary.org/obo/ENVO_01001825>	"active anaerobic enrichment culturing unit"	"An active enrichment culturing unit which contains environmental material maintained under conditions with no free oxygen."
<http://purl.obolibrary.org/obo/ENVO_01001822>	"active enrichment culturing unit"	"An enrichment culturing unit which contains environmental material bearing ecological assemblages undergoing selection through experimentally imposed conditions."
<http://purl.obolibrary.org/obo/ENVO_01000669>	"active geological fault"	"An active fault is a fault that is likely to become the source of another earthquake sometime in the future. Geologists commonly consider faults to be active if there has been movement observed or evidence of seismic activity during the last 10,000 years."
<http://purl.obolibrary.org/obo/ENVO_01001826>	"active sulphate-reducing enrichment culturing unit"	"An active enrichment culturing unit which contains environmental material maintained under conditions that favour the reduction of sulphate."
<http://purl.obolibrary.org/obo/ENVO_01001105>	"aeolian lake"	"A lake which fills a basin that has been dammed by wind-blown sand,  formed between sand dunes oriented by winds; or formed by wind action under previously arid paleoenvironments."
<http://purl.obolibrary.org/obo/ENVO_00002126>	"aerobic bioreactor"	"A bioreactor in which the contained material is well-oxygenated."
<http://purl.obolibrary.org/obo/ENVO_00002210>	"aerobic sulfide-oxidizing bioreactor"	"An aerobic bioreactive which contains microbial communities capable of sulfide oxidation."
<http://purl.obolibrary.org/obo/ENVO_01000986>	"agricultural fairground"	"A fairground which is used to exhibit agricultural technology, livestock, and farm-related activity."
<http://purl.obolibrary.org/obo/ENVO_00000114>	"agricultural field"	"A field which is located on land and used for agricultural purposes, such as the grazing of livestock or the cultivation of crops."
<http://purl.obolibrary.org/obo/ENVO_00000519>	"agricultural terrace"	"A terrace which is used for agricultural activities."
<http://purl.obolibrary.org/obo/ENVO_00002874>	"air conditioning unit"	"A manufactuered product which is capable of removing heat and controlling the humidity of the air within a site."
<http://purl.obolibrary.org/obo/ENVO_00003968>	"air filter"	"An air filter is a device that removes some substance from air."
<http://purl.obolibrary.org/obo/ENVO_03501208>	"air vent"	"A manufactured product consisting of a duct opening which allows air to circulate."
<http://purl.obolibrary.org/obo/ENVO_01001488>	"aircraft"	"A vehicle which is able to travel through air in an atmosphere."
<http://purl.obolibrary.org/obo/ENVO_03501349>	"airplane"	"An aircraft which 1) has fixed wings and 2) is propelled by a thrust from a jet engine, propeller, or rocket engine."
<http://purl.obolibrary.org/obo/ENVO_00000438>	"alas"	"A steep-sided depression formed by the melting of permafrost; it may contain a lake."
<http://purl.obolibrary.org/obo/ENVO_03600090>	"alcohol fermentation pit"	"A fermentation pit which is constructed to facilitate the fermentation of alcoholic substances."
<http://purl.obolibrary.org/obo/ENVO_2000004>	"algal bloom"	"A feature that arises from a rapid increase or accumulation in the population of algae (typically microscopic) in an aquatic system."
<http://purl.obolibrary.org/obo/ENVO_00002119>	"alkaline hot spring"	"A alkaline spring through which groundwater, heated by geothermal energy, flows."
<http://purl.obolibrary.org/obo/ENVO_00002121>	"alkaline salt lake"	"A saline lake which has a high pH."
<http://purl.obolibrary.org/obo/ENVO_01001894>	"alkaline spring"	"A mineral spring through which water with a high pH flows."
<http://purl.obolibrary.org/obo/ENVO_00005745>	"allotment garden"	"A garden which is made available for individual, non-commercial gardening or growing food plants."
<http://purl.obolibrary.org/obo/ENVO_00000258>	"alluvial plain"	"A relatively flat and gently sloping landform found at the base of a range of hills or mountains, formed by the deposition of alluvial soil over a long period of time by one or more streams coming from the mountains."
<http://purl.obolibrary.org/obo/ENVO_01001891>	"alum spring"	"A spring through which water with elevated concentrations of hydrated double sulfate aluminium salts flows."
<http://purl.obolibrary.org/obo/ENVO_03501103>	"ambulance"	"A motor vehicle which is equipped with medical equipment and can be used to transport humans to treatment facilities."
<http://purl.obolibrary.org/obo/ENVO_00000451>	"amenity lake"	"A lake constructed, or modified, for the chief purpose of providing an amenity."
<http://purl.obolibrary.org/obo/ENVO_01000284>	"amictic lake"	"A lake which is permanently covered by ice, does not mix, and exhibit inverse cold water stratification whereby water temperature increases with depth below the ice surface."
<http://purl.obolibrary.org/obo/ENVO_00000152>	"anabranch"	"A section of a river or stream that diverts from the main course and rejoins later."
<http://purl.obolibrary.org/obo/ENVO_00002124>	"anaerobic bioreactor"	"A bioreactor in which the contained material is not oxygenated (i.e. void of biologically consequential free oxygen)"
<http://purl.obolibrary.org/obo/ENVO_00002125>	"anaerobic dechlorinating bioreactor"	"A device or system that supports a biologically active environment. A vessel in which is carried out a chemical process which involves organisms or biochemically active substances derived from such organisms. This process can either be aerobic or anaerobic."
<http://purl.obolibrary.org/obo/ENVO_00002213>	"anaerobic sludge blanket reactor"	"An anaerobic bioreactor which is capable of treating wastewater through the action of methanogenic microbes which form a blanket of sludge due to the upward flow in the reactor."
<http://purl.obolibrary.org/obo/ENVO_01000367>	"anchialine cave"	"An anchialine cave is a cave which contains an anchialine pool."
<http://purl.obolibrary.org/obo/ENVO_01000368>	"anchialine pool"	"An anchialine pool is a landlocked water body with a subterranean connection to the ocean and which has fresh water towards its surface with saline water in its deeper layers."
<http://purl.obolibrary.org/obo/ENVO_01000439>	"andesitic volcano"	"A volcano which has been formed as a result of the eruption of andesitic lava."
<http://purl.obolibrary.org/obo/ENVO_01000922>	"animal cage"	"A manufactured cage which may be used to confine, contain, or protect an animal."
<http://purl.obolibrary.org/obo/ENVO_01001120>	"animal manure product"	"A product which is composed primarily of animal manure that has been heat treated and packaged as a product for commercial or consumer use."
<http://purl.obolibrary.org/obo/ENVO_01000975>	"animal trap"	"A manufactured product which is designed to catch and hold animals."
<http://purl.obolibrary.org/obo/ENVO_01000607>	"animal-drawn cart"	"An animal-drawn cart is a cart which is attached to one or more working or draught animals."
<http://purl.obolibrary.org/obo/ENVO_01001072>	"anoxic lake"	"A lake which is primarily composed of anoxic water."
<http://purl.obolibrary.org/obo/ENVO_00002204>	"anthropogenic contamination feature"	"An anthropogenic geographic feature which has increased levels of contaminants in its consituent materials."
<http://purl.obolibrary.org/obo/ENVO_00000002>	"anthropogenic geographic feature"	"An anthropogenic geographic feature is a geographic feature resulting from the influence of human beings on nature."
<http://purl.obolibrary.org/obo/ENVO_00000530>	"apron"	"A gentle slope, with a generally smooth surface, particularly found around groups of islands and seamounts."
<http://purl.obolibrary.org/obo/ENVO_00000072>	"aquaduct"	"Structure designed to transport water from a remote source, usually by gravity."
<http://purl.obolibrary.org/obo/ENVO_00002196>	"aquarium"	"An aquarium is a vivarium which simulates the submerged portions of an aquatic environment"
<http://purl.obolibrary.org/obo/ENVO_00000220>	"archipelago"	"A group of geographically or geologically associated islands."
<http://purl.obolibrary.org/obo/ENVO_01003021>	"area of high atmospheric pressure"	"A gaseous part of an atmosphere in which gases have increased atmospheric pressure."
<http://purl.obolibrary.org/obo/ENVO_01001300>	"area of low atmospheric pressure"	"A gaseous part of an atmosphere in which gases have reduced atmospheric pressure."
<http://purl.obolibrary.org/obo/ENVO_01000428>	"area of rocky shore"	"A rocky shore is an intertidal area of a seacoast where solid rock is the predominant substrate."
<http://purl.obolibrary.org/obo/ENVO_00000429>	"arete"	"A ridge which is jagged, narrow and separates glacier valleys or cirques."
<http://purl.obolibrary.org/obo/ENVO_00000538>	"arrugado"	"An undersea area of subdued corrugations."
<http://purl.obolibrary.org/obo/ENVO_00000121>	"artificial channel"	"A channel of a watercource which has been constructed by humans or their technologies."
<http://purl.obolibrary.org/obo/ENVO_00000464>	"artificial harbor"	"A harbor constructed by human agency."
<http://purl.obolibrary.org/obo/ENVO_00000377>	"artificial lake"	"A lake purposefully constructed."
<http://purl.obolibrary.org/obo/ENVO_03600092>	"artificial pond"	"A pond which has been constructed by humans or their technologies."
<http://purl.obolibrary.org/obo/ENVO_00000149>	"artificial reef"	"Chains of rocks or coral at or near the surface of water constructed by man."
<http://purl.obolibrary.org/obo/ENVO_00000399>	"ash cone"	"A cone that is composed of particles of silt to sand size. Explosive eruptions from a vent where the magma is interacting with groundwater or the sea (as in an eruption off the coast) produce steam and are called phreatic. The interaction between the magma, expanding steam, and volcanic gases results in the ejection of mostly small particles called ash. Fallen ash has the consistency of flour. The unconsolidated ash forms an ash cone which becomes a tuff cone or tuff ring once the ash consolidates."
<http://purl.obolibrary.org/obo/ENVO_00000165>	"asphalt lake"	"A lake formed of a natural deposit of alphalt, a black, highly viscous liquid or semi-solid composed of fossil hydrocarbons."
<http://purl.obolibrary.org/obo/ENVO_01000813>	"astronomical body part"	"A material part of an astronomical body."
<http://purl.obolibrary.org/obo/ENVO_03000118>	"atmosphere and water column exposed melt pond"	"A melt pond which and is exposed to the atmosphere and to a lesser degree water underlying the ice mass which contains it."
<http://purl.obolibrary.org/obo/ENVO_03000050>	"atmosphere-exposed melt pond"	"A melt pond which has a surface exposed to the atmosphere."
<http://purl.obolibrary.org/obo/ENVO_01000300>	"atmospheric Taylor column"	"An atmospheric Taylor column is a Taylor column that is formed in the atmosphere. Atmospheric Taylor columns often form above islands resulting in vortex streets in the atmosphere."
<http://purl.obolibrary.org/obo/ENVO_01001668>	"atmospheric frontal zone"	"Part of an atmosphere which contains a weather front, bounded by frontal surfaces."
<http://purl.obolibrary.org/obo/ENVO_01000911>	"automated teller machine"	"An electronic telecommunications device that enables the customers of a financial institution to perform financial transactions, particularly cash withdrawal, without the need for a human cashier, clerk or bank teller."
<http://purl.obolibrary.org/obo/ENVO_03510002>	"automatic transmission fluid"	"Fluid used for valve operation, brake band friction, and gear lubrication within an automatic vehicle transmission."
<http://purl.obolibrary.org/obo/ENVO_00002277>	"back-arc basin"	"A depression in the sea floor that results from the collision of continental plates; the weight of the sinking plate causes the overlying plate to stretch and thin, causing a basin in the overlying plate. Sometimes, the Earth's crust in these basins stretches so much it cracks, allowing magma through from the mantle beneath. Hence, basins often contain active volcanoes and hydrothermal vents."
<http://purl.obolibrary.org/obo/ENVO_00000472>	"backwater"	"An area of calm water unaffected by the current of a stream."
<http://purl.obolibrary.org/obo/ENVO_00000127>	"badland"	"An arid terrain with clay-rich soil that has been extensively eroded by wind and water."
<http://purl.obolibrary.org/obo/ENVO_01000873>	"ballast tank"	"A ballast tank is a compartment within a boat, ship or other floating structure that holds water, which is used as ballast to provide stability for a vessel."
<http://purl.obolibrary.org/obo/ENVO_00000141>	"bank"	"The sloping margin of a watercourse, serving to confine it to its natural channel."
<http://purl.obolibrary.org/obo/ENVO_00000167>	"bar"	"A linear shoaling landform feature within a body of water. Bars tend to be long and narrow (linear) and develop where a current (or waves) promote deposition of granular material, resulting in localized shallowing (shoaling) of the water. Bars can appear in the sea, in a lake, or in a river. They are typically composed of sand, although could be of any granular matter that the moving water has access to and is capable of shifting around (for example, soil, silt, gravel, cobble, shingle, or even boulders). The grain size of the material comprising a bar is related: to the size of the waves or the strength of the currents moving the material, but the availability of material to be worked by waves and currents is also important."
<http://purl.obolibrary.org/obo/ENVO_01000521>	"batholith"	"A batholith is an area of mostly continuous plutonic (igneous intrusive) rock that covers an area larger than 100 square kilometers, formed in the planetary crust, and exposed by erosion. On Earth, Batholiths are almost always made mostly of felsic or intermediate rock-types, such as granite, quartz monzonite, or diorite."
<http://purl.obolibrary.org/obo/ENVO_01000991>	"bathtub fixture"	"A plumbing fixture which may serve as a container for water in which humans or other animals may bathe."
<http://purl.obolibrary.org/obo/ENVO_01000573>	"battery-powered electric lamp"	"A battery-powered electric lamp is an electric lamp which draws its power from a device composed of two or more electrochemical cells that convert stored chemical energy into electrical energy."
<http://purl.obolibrary.org/obo/ENVO_00000032>	"bay"	"An area of water bordered by land on three sides."
<http://purl.obolibrary.org/obo/ENVO_00000234>	"bayou"	"A small, slow-moving stream or creek; usually located in low-lying areas."
<http://purl.obolibrary.org/obo/ENVO_00000091>	"beach"	"A landform consisting of loose rock particles such as sand, gravel, shingle, pebbles, cobble, or even shell fragments along the shoreline of a body of water."
<http://purl.obolibrary.org/obo/ENVO_00000529>	"beach ridge"	"A ridge of sand just inland and parallel to the beach, usually in series."
<http://purl.obolibrary.org/obo/ENVO_00000270>	"beaver pond"	"A pond that has formed as a consequence of the activities of beavers, building a beaver dam."
<http://purl.obolibrary.org/obo/ENVO_01000592>	"bed base"	"A bed base is a piece of furniture which supports a mattress."
<http://purl.obolibrary.org/obo/ENVO_01000591>	"bed frame"	"A bed frame is a piece of furniture which is used to position a mattress and bed base and may include a means of supporting a canopy."
<http://purl.obolibrary.org/obo/ENVO_02000002>	"bedclothing"	"Bedclothing is a textile covering used on a bed as a sheet, blanket, or pillowcase."
<http://purl.obolibrary.org/obo/ENVO_00000001>	"bedding-plane cave"	"A cavity developed along a bedding-plane and elongate in cross-section as a result."
<http://purl.obolibrary.org/obo/ENVO_01000589>	"bench"	"A bench is a piece of furniture, on which several people may sit at the same time."
<http://purl.obolibrary.org/obo/ENVO_01000614>	"bicycle"	"A bicycle is a human-powered, pedal-driven, single-track vehicle, having two wheels attached to a frame, one behind the other."
<http://purl.obolibrary.org/obo/ENVO_00002152>	"biofilter"	"A bioreactor which captures and, through the biological processes maintained in the medium it contains, degrades pollutants."
<http://purl.obolibrary.org/obo/ENVO_02000043>	"biological product"	"A biological product is an environmental substrate comprised of any virus, therapeutic serum, toxin, antitoxin, or analogous product available to prevent, treat or cure diseases or injuries in man."
<http://purl.obolibrary.org/obo/ENVO_01001816>	"biomaterial containment unit"	"A manufactured product which has been designed to contain a mass of biomaterial."
<http://purl.obolibrary.org/obo/ENVO_01001817>	"biomaterial culturing unit"	"A biomaterial containment unit which is designed to allow the growth and propagation of the biomaterial it contains."
<http://purl.obolibrary.org/obo/ENVO_00002123>	"bioreactor"	"A biomaterial containment unit which is capable of 1) containing a mass of environmental material which hosts an active collection of organisms and 2) maintaining conditions which are conducive to one or more metabolic activities of the organisms it contains."
<http://purl.obolibrary.org/obo/ENVO_01000817>	"biosphere"	"An astronomical body part which includes all the living entities within the gravitational sphere of influence of that body, as well as the non-living and dead entities with which they interact."
<http://purl.obolibrary.org/obo/ENVO_00000218>	"black smoker"	"A hydrothermal vent found on the ocean floor. The vents are formed in fields hundreds of meters wide when superheated water from below the Earth's crust comes through the ocean floor. The superheated water is rich in dissolved minerals from the crust, most notably sulfides, which crystallize to create a chimney-like structure around each vent. When the superheated water in the vent comes in contact with the cold ocean water, many minerals are precipitated, creating the distinctive black color. The metal sulfides that are deposited can become massive sulfide ore deposits in time."
<http://purl.obolibrary.org/obo/ENVO_01001775>	"blind thrust fault"	"A thrust fault which does not breach the surface of an astronomical body."
<http://purl.obolibrary.org/obo/ENVO_00000168>	"blowhole"	"A hole in coastal rock through which sea water is forced by a rising tide or waves and spurted through an outlet into the air."
<http://purl.obolibrary.org/obo/ENVO_00000313>	"blowout"	"A sandy depression in a sand dune ecosystem (psammosere) caused by the removal of sediments by wind."
<http://purl.obolibrary.org/obo/ENVO_01000608>	"boat"	"A boat is a watercraft of any size which is able to float or plane on water."
<http://purl.obolibrary.org/obo/ENVO_01001476>	"body of liquid"	"A liquid astronomical body part which is continuous and is delimited by physical discontinuities or non-liquid boundaries."
<http://purl.obolibrary.org/obo/ENVO_00002226>	"borehole"	"A channel which is constructed by removing materials from land or submerged beds."
<http://purl.obolibrary.org/obo/ENVO_00010624>	"botanical garden"	"A place where a wide variety of plants primarily categorized and documented for scientific purposes."
<http://purl.obolibrary.org/obo/ENVO_03501326>	"bottle"	"A container which is typically made of glass or plastic and having a tapered neck, used primarily for holding liquids."
<http://purl.obolibrary.org/obo/ENVO_00000537>	"boulder field"	"A high altitude or high latitude bare, flat area covered with large angular rocks."
<http://purl.obolibrary.org/obo/ENVO_00002137>	"brackish estuary"	"An estuary which is composed primarily of brackish water."
<http://purl.obolibrary.org/obo/ENVO_00000540>	"brackish lake"	"A lake which is primarily composed of brackish water, having a higher salinity than fresh water but a lower salinity than marine water."
<http://purl.obolibrary.org/obo/ENVO_00000541>	"brackish pond"	"A pond which is composed primarily of brackish water."
<http://purl.obolibrary.org/obo/ENVO_01001321>	"brackish water body"	"A body of water which is primarily composed of brackish water."
<http://purl.obolibrary.org/obo/ENVO_03510001>	"brake fluid"	"A hydraulic fluid which is 1) used in hydraulic brake and hydraulic clutch applications in vehicles to amplify braking force and 2) composed primarily of ethylene glycol, polyglycols, silicone fluids, and isobutyl alcohol."
<http://purl.obolibrary.org/obo/ENVO_01000475>	"brick"	"A brick is a masonry unit which is composed of kneaded clay-bearing soil, expanded clay aggregate, sand and lime, or concrete material, fire-hardened or air-dried."
<http://purl.obolibrary.org/obo/ENVO_03000041>	"brine channel"	"A channel through which brine flows."
<http://purl.obolibrary.org/obo/ENVO_00000369>	"brine pool"	"MERGED DEFINITION:\nTARGET DEFINITION: A large area of brine on the ocean basin near cold seep vents which release methane into the water. These pools are concentrations of water having an extremely high salinity as compared to the surrounding ocean, caused by the motion of large salt deposits through salt tectonics.\n--------------------\nSOURCE DEFINITION: Marine brine pools are large areas of brine on the ocean basin. These pools are bodies of water that have a salinity three to five times greater than the surrounding ocean. For deep-sea brine pools the source of the salt is the dissolution of large salt deposits through salt tectonics. The brine often contains high concentrations of methane, providing energy to chemosynthetic animals that live near the pool."
<http://purl.obolibrary.org/obo/ENVO_03501291>	"broiler"	"A part of an oven or a small stove used to broil food."
<http://purl.obolibrary.org/obo/ENVO_01001823>	"bubble plume"	"A plume which is composed primarily of bubbles."
<http://purl.obolibrary.org/obo/ENVO_03600085>	"buoy"	"A manufactured product which floats in water and can be used a navigational marker among other purposes."
<http://purl.obolibrary.org/obo/ENVO_01000501>	"burnt brick"	"A burnt brick is a brick which has been dried at an elvated temperature in a kiln, furnace, or with similar technology ."
