?class	?label	?definition
<http://purl.obolibrary.org/obo/ENVO_01000530>	"ventilated improved pit latrine"	"A ventilated improved pit latrine is a pit latrine which includes a vent pipe fitted to the pit with a flyscreen covering the pipe's outlet. Air currents moving across the outlet of the vent pipe create a vaccum which draws odors out of the latrine's superstructure."
<http://purl.obolibrary.org/obo/ENVO_00010622>	"vivarium"	"A vivarium is an enclosure for keeping and raising organisms for observation or research. Often, a portion of the ecosystem for a particular species is simulated on a smaller scale, with controls for environmental conditions."
<http://purl.obolibrary.org/obo/ENVO_01000603>	"water truck"	"A water truck is a truck which transports water."
<http://purl.obolibrary.org/obo/ENVO_01000613>	"watercraft"	"A watercraft is a vehicle which is able to travel on or through water."
<http://purl.obolibrary.org/obo/ENVO_01000978>	"wet pitfall trap"	"A pitfall trap in which the container used to hold trapped animals is filled with a liquid solution formulated to hold, kill, and preserve any animal or animals which falls within it."
